{
  "schema_version": "agent-dispatch.aggregate-event/v1",
  "aggregate_id": "019c2234-9abc-7def-8901-234567890abc",
  "decision_id": "019c2234-5678-7abc-9def-012345678901",
  "route_id": "wiki-maintenance",
  "route_revision": "sha256:5f3a18c90b7e4d2aa1c6f8d0e9b2c7a4b8d9e0f1a2b3c4d5e6f7a8b9c0d1e2f3a4",
  "resource_id": "vault-main",
  "origin": "arrival",
  "generation": 1,
  "content_fingerprint": "sha256:dddddddddddddddddddddddddddddddddddddddddddddddddddddddddddddddd",
  "selection": [
    {
      "destination_id": "wiki-primary",
      "destination_revision": "dst-5394fe54daf4b820811b90644e147bd8b0221f3836e0cb853a321d6368658b60",
      "workstream": "maintenance",
      "reason": "fanout_mode:all"
    }
  ],
  "created_at": "2026-08-29T09:30:12.482Z"
}
